{"$schema":"https://json-schema.org/draft/2020-12/schema","title":"ADWF capability live evidence certification registry v1","type":"object","additionalProperties":false,"required":["$schema","schema_version","role","certifications","registry_sha256"],"properties":{"$schema":{"const":".adwf/schemas/capability-live-evidence-certification.schema.json"},"schema_version":{"const":1},"role":{"const":"CANONICAL_CAPABILITY_LIVE_EVIDENCE_CERTIFICATIONS"},"certifications":{"type":"array","minItems":1,"items":{"oneOf":[{"type":"object","additionalProperties":false,"required":["id","evidence_class","capability_ids","subject","provider","report_sha256","consumer","framework","transitions","external_source_unchanged","write_back_performed","certification_sha256"],"properties":{"id":{"type":"string","pattern":"^CERT-[A-Z0-9_-]+$"},"evidence_class":{"const":"REAL_EXTERNAL_CONSUMER_UPGRADE"},"capability_ids":{"type":"array","minItems":1,"items":{"type":"string","pattern":"^[A-Z0-9_-]+$"}},"subject":{"type":"object","additionalProperties":false,"required":["sha","tree"],"properties":{"sha":{"type":"string","pattern":"^[0-9a-f]{40}$"},"tree":{"type":"string","pattern":"^[0-9a-f]{40}$"}}},"provider":{"type":"object","additionalProperties":false,"required":["provider","repository","workflow_run_id","workflow_name","workflow_run_head_sha","check_run_id","check_name","check_app_id","check_app_slug"],"properties":{"provider":{"const":"github"},"repository":{"type":"string","minLength":3},"workflow_run_id":{"type":"integer","minimum":1},"workflow_name":{"type":"string","minLength":3},"workflow_run_head_sha":{"type":"string","pattern":"^[0-9a-f]{40}$"},"check_run_id":{"type":"integer","minimum":1},"check_name":{"type":"string","minLength":3},"check_app_id":{"type":"integer","minimum":1},"check_app_slug":{"type":"string","minLength":3}}},"report_sha256":{"type":"string","format":"sha256"},"consumer":{"type":"object","additionalProperties":false,"required":["repository","sha","tree"],"properties":{"repository":{"type":"string","minLength":3},"sha":{"type":"string","pattern":"^[0-9a-f]{40}$"},"tree":{"type":"string","pattern":"^[0-9a-f]{40}$"}}},"framework":{"type":"object","additionalProperties":false,"required":["source_sha","source_tree","target_sha","target_tree"],"properties":{"source_sha":{"type":"string","pattern":"^[0-9a-f]{40}$"},"source_tree":{"type":"string","pattern":"^[0-9a-f]{40}$"},"target_sha":{"type":"string","pattern":"^[0-9a-f]{40}$"},"target_tree":{"type":"string","pattern":"^[0-9a-f]{40}$"}}},"transitions":{"type":"object","additionalProperties":false,"required":["adoption","upgrade_b","rollback_a","retry_b"],"properties":{"adoption":{"const":"COMMITTED"},"upgrade_b":{"const":"COMMITTED"},"rollback_a":{"const":"ROLLED_BACK"},"retry_b":{"const":"COMMITTED"}}},"external_source_unchanged":{"const":true},"write_back_performed":{"const":false},"certification_sha256":{"type":"string","format":"sha256"}}},{"type":"object","additionalProperties":false,"required":["id","evidence_class","capability_ids","self_host","connected_consumer","certification_sha256"],"properties":{"id":{"type":"string","pattern":"^CERT-[A-Z0-9_-]+$"},"evidence_class":{"const":"SESSION_CONTINUITY_HANDOVER"},"capability_ids":{"type":"array","minItems":1,"maxItems":1,"uniqueItems":true,"items":{"const":"SESSION_CONTINUITY"}},"self_host":{"type":"object","additionalProperties":false,"required":["repository","subject","issue","ledger","session_a","session_b","safety"],"properties":{"repository":{"type":"string","minLength":3},"subject":{"type":"object","additionalProperties":false,"required":["sha","tree"],"properties":{"sha":{"type":"string","pattern":"^[0-9a-f]{40}$"},"tree":{"type":"string","pattern":"^[0-9a-f]{40}$"}}},"issue":{"type":"object","additionalProperties":false,"required":["number","state","terminal_comment_id","terminal_comment_sha256"],"properties":{"number":{"type":"integer","minimum":1},"state":{"const":"closed"},"terminal_comment_id":{"type":"integer","minimum":1},"terminal_comment_sha256":{"type":"string","format":"sha256"}}},"ledger":{"type":"object","additionalProperties":false,"required":["issue_number","comment_id","comment_sha256","event_hash","checkpoint_digest","event_anchor"],"properties":{"issue_number":{"type":"integer","minimum":1},"comment_id":{"type":"integer","minimum":1},"comment_sha256":{"type":"string","format":"sha256"},"event_hash":{"type":"string","format":"sha256"},"checkpoint_digest":{"type":"string","format":"sha256"},"event_anchor":{"type":"object","additionalProperties":false,"required":["tag","tag_object_sha","target_sha","message_sha256"],"properties":{"tag":{"type":"string","minLength":3},"tag_object_sha":{"type":"string","pattern":"^[0-9a-f]{40}$"},"target_sha":{"type":"string","pattern":"^[0-9a-f]{40}$"},"message_sha256":{"type":"string","format":"sha256"}}}}},"session_a":{"type":"object","additionalProperties":false,"required":["run_id","workflow_name","head_sha","job_id","job_name","evidence_blob_sha"],"properties":{"run_id":{"type":"integer","minimum":1},"workflow_name":{"type":"string","minLength":3},"head_sha":{"type":"string","pattern":"^[0-9a-f]{40}$"},"job_id":{"type":"integer","minimum":1},"job_name":{"type":"string","minLength":2},"evidence_blob_sha":{"type":"string","pattern":"^[0-9a-f]{40}$"}}},"session_b":{"type":"object","additionalProperties":false,"required":["run_id","workflow_name","head_sha","job_id","job_name","evidence_blob_sha"],"properties":{"run_id":{"type":"integer","minimum":1},"workflow_name":{"type":"string","minLength":3},"head_sha":{"type":"string","pattern":"^[0-9a-f]{40}$"},"job_id":{"type":"integer","minimum":1},"job_name":{"type":"string","minLength":2},"evidence_blob_sha":{"type":"string","pattern":"^[0-9a-f]{40}$"}}},"safety":{"type":"object","additionalProperties":false,"required":["provider_authority","independent_checkout","session_a_local_runtime_present","stale_authority_allowed"],"properties":{"provider_authority":{"const":false},"independent_checkout":{"const":true},"session_a_local_runtime_present":{"const":false},"stale_authority_allowed":{"const":false}}}}},"connected_consumer":{"type":"object","additionalProperties":false,"required":["repository","subject","installed_framework","issue","ledger","legacy_duplicate","session_a","session_b","accepted_defect","safety"],"properties":{"repository":{"type":"string","minLength":3},"subject":{"type":"object","additionalProperties":false,"required":["sha","tree"],"properties":{"sha":{"type":"string","pattern":"^[0-9a-f]{40}$"},"tree":{"type":"string","pattern":"^[0-9a-f]{40}$"}}},"installed_framework":{"type":"object","additionalProperties":false,"required":["sha","tree"],"properties":{"sha":{"type":"string","pattern":"^[0-9a-f]{40}$"},"tree":{"type":"string","pattern":"^[0-9a-f]{40}$"}}},"issue":{"type":"object","additionalProperties":false,"required":["number","state","terminal_comment_id","terminal_comment_sha256"],"properties":{"number":{"type":"integer","minimum":1},"state":{"const":"closed"},"terminal_comment_id":{"type":"integer","minimum":1},"terminal_comment_sha256":{"type":"string","format":"sha256"}}},"ledger":{"type":"object","additionalProperties":false,"required":["issue_number","comment_id","comment_sha256","event_hash","checkpoint_digest","root_anchor","event_anchor"],"properties":{"issue_number":{"type":"integer","minimum":1},"comment_id":{"type":"integer","minimum":1},"comment_sha256":{"type":"string","format":"sha256"},"event_hash":{"type":"string","format":"sha256"},"checkpoint_digest":{"type":"string","format":"sha256"},"root_anchor":{"type":"object","additionalProperties":false,"required":["tag","tag_object_sha","target_sha","message_sha256"],"properties":{"tag":{"type":"string","minLength":3},"tag_object_sha":{"type":"string","pattern":"^[0-9a-f]{40}$"},"target_sha":{"type":"string","pattern":"^[0-9a-f]{40}$"},"message_sha256":{"type":"string","format":"sha256"}}},"event_anchor":{"type":"object","additionalProperties":false,"required":["tag","tag_object_sha","target_sha","message_sha256"],"properties":{"tag":{"type":"string","minLength":3},"tag_object_sha":{"type":"string","pattern":"^[0-9a-f]{40}$"},"target_sha":{"type":"string","pattern":"^[0-9a-f]{40}$"},"message_sha256":{"type":"string","format":"sha256"}}}}},"legacy_duplicate":{"type":"object","additionalProperties":false,"required":["issue_number","state","state_reason"],"properties":{"issue_number":{"type":"integer","minimum":1},"state":{"const":"closed"},"state_reason":{"const":"duplicate"}}},"session_a":{"type":"object","additionalProperties":false,"required":["run_id","workflow_name","head_sha","job_id","job_name","runner_name","evidence_blob_sha"],"properties":{"run_id":{"type":"integer","minimum":1},"workflow_name":{"type":"string","minLength":3},"head_sha":{"type":"string","pattern":"^[0-9a-f]{40}$"},"job_id":{"type":"integer","minimum":1},"job_name":{"type":"string","minLength":2},"runner_name":{"type":"string","minLength":3},"evidence_blob_sha":{"type":"string","pattern":"^[0-9a-f]{40}$"}}},"session_b":{"type":"object","additionalProperties":false,"required":["run_id","workflow_name","head_sha","job_id","job_name","runner_name","evidence_blob_sha"],"properties":{"run_id":{"type":"integer","minimum":1},"workflow_name":{"type":"string","minLength":3},"head_sha":{"type":"string","pattern":"^[0-9a-f]{40}$"},"job_id":{"type":"integer","minimum":1},"job_name":{"type":"string","minLength":2},"runner_name":{"type":"string","minLength":3},"evidence_blob_sha":{"type":"string","pattern":"^[0-9a-f]{40}$"}}},"accepted_defect":{"type":"object","additionalProperties":false,"required":["repository","issue_number","state"],"properties":{"repository":{"type":"string","minLength":3},"issue_number":{"type":"integer","minimum":1},"state":{"const":"closed"}}},"safety":{"type":"object","additionalProperties":false,"required":["provider_authority","no_duplicate_writer","no_stale_mutation","no_runtime_ledger_write_session_b","singleton_ledger","stale_checkpoint_rejected"],"properties":{"provider_authority":{"const":false},"no_duplicate_writer":{"const":true},"no_stale_mutation":{"const":true},"no_runtime_ledger_write_session_b":{"const":true},"singleton_ledger":{"const":true},"stale_checkpoint_rejected":{"const":true}}}}},"certification_sha256":{"type":"string","format":"sha256"}}}]}} ,"registry_sha256":{"type":"string","format":"sha256"}}}
